Date,Winner,King Freight Dash for Cash,Exide Batteries Rookie of the Race,Dartmouth Dodge Heat Winners,Atlantic Tiltload Time Trials
May 24,Dylan Belnkhorn,Cole Butcher,D.J. Casey,George Koszkulics Jerome Kehoe,Dylan Gosbee
May 30,Dylan Blenkhorn,Dylan Blenkhorn,DJ Casey,Kent Vincent Donald Chisholm,Dylan Blenkhorn
June 13,George Koszkulics,Donald Chisholm,Joel Hickox,Greg Proude Robbie MacEwen,Donald Chisholm
June 20,Cole Butcher,Donald Chisholm,Joel Hickox,Darren MacKinnon DJ Casey,Dylan Belnkhorn
June 27,Darren Mackinnon,Dylan Blenkhorn,DJ Casey,Greg Proude Dylan Gosbee,Shawn Turple
