Round,Date,Circuit,Location,Pole position,Winning driver,Winning team
1,April 17,Long Beach street circuit,"Long Beach, California",Peter Cunningham,Neil Crompton,Tasman Motorsports
2,April 17,Long Beach street circuit,"Long Beach, California",Peter Cunningham,Neil Crompton,Tasman Motorsports
3,May 17,Hutchinson Island,"Savannah, Georgia",Peter Cunningham,Peter Cunningham,Honda American Racing Team
4,May 18,Hutchinson Island,"Savannah, Georgia",Peter Cunningham,Peter Cunningham,Honda American Racing Team
5,June 8,Belle Isle Park,"Detroit, Michigan",David Donohue,David Donohue,PacWest Touring Car Group
