Year,Aruba,Jamaica,Sint Maarten,Antigua and Barbuda,Bonaire,British Virgin Islands,Curaçao
2001,N/A Aruba,DNQ,N/A Sint Maarten,DNQ,DNQ,DNQ,Pariba LL Willemstad
2002,Aruba South LL Sint Nicolaas,DNQ,St. Maarten LL Philipsburg,DNQ,Bonaire LL Kralendijk,DNQ,Pariba LL Willemstad
2003,Aruba Central LL Santa Cruz,DNQ,St. Maarten LL Phillipsburg,DNQ,DNQ,BVI Little League Road Town,Pabao LL Willemsted
2004,Aruba South LL Sint Nicolaas,DNQ,St. Maarten LL Philipsburg,DNQ,Bonaire LL Kralendijk,BVI Little League Road Town,Pabao LL Willemstad
2005,Aruba North LL Oranjestad,DNQ,St. Maarten LL Philipsburg,DNQ,Bonaire LL Kralendijk,DNQ,Pabao LL Willemstad
