Network,8:00 PM,8:30 PM,9:00 PM,9:30 PM,10:00 PM,10:30 PM
Fall,People Do the Craziest Things,Who's the Boss?,Glitter,Glitter,20/20,20/20
Follow-up,The ABC Thursday Night Movie,The ABC Thursday Night Movie,The ABC Thursday Night Movie,The ABC Thursday Night Movie,20/20,20/20
Spring,Wildside,Wildside,Eye to Eye,Eye to Eye,20/20,20/20
Follow-up,Street Hawk,Street Hawk,Specials,Specials,20/20,20/20
Summer,The ABC Thursday Night Movie,The ABC Thursday Night Movie,The ABC Thursday Night Movie,The ABC Thursday Night Movie,20/20,20/20
