Network,7:30 PM,8:00 PM,9:00 PM,9:30 PM,10:00 PM,10:30 PM
Fall,Custer,Custer,The ABC Wednesday Night Movie,The ABC Wednesday Night Movie,The ABC Wednesday Night Movie,The ABC Wednesday Night Movie
Winter,The Avengers,The Avengers,The ABC Wednesday Night Movie,The ABC Wednesday Night Movie,The ABC Wednesday Night Movie,The ABC Wednesday Night Movie
Spring,The Avengers,The Avengers,The ABC Wednesday Night Movie,The ABC Wednesday Night Movie,The ABC Wednesday Night Movie,The ABC Wednesday Night Movie
Fall,Lost in Space,Lost in Space,Green Acres (15/22.8),He & She,Dundee and the Culhane,Dundee and the Culhane
Follow-up,Lost in Space,Lost in Space,Green Acres (15/22.8),He & She,The Jonathan Winters Show,The Jonathan Winters Show
