Year,Team(Men's),Team(Women's),Singles(Men's),Singles(Women's),Doubles(Women's),Doubles(Mixed)
2017 Wuxi,China,China,Fan Zhendong,Miu Hirano,Zhu Yuling Chen Meng,Zhou Yu Chen Xingtong
2015 Pattaya,China,China,Fan Zhendong,Zhu Yuling,Kim Hye-song Ri Mi-Gyong,Fan Zhendong Chen Meng
2013 Busan,China,China,Ma Long,Liu Shiwen,Chen Meng Zhu Yuling,Lee Sang-Su Park Young-Sook
2011 Macau,China,China,Ma Long,Guo Yan,Ding Ning Guo Yan,Xu Xin Guo Yan
2009 Lucknow,China,China,Ma Long,Ding Ning,Ding Ning Li Xiaoxia,Ma Long Li Xiaoxia
